{
  "$schema": "https://registry.getarcane.app/schema.json",
  "name": "Arcane Community Templates",
  "description": "Community Docker Compose Templates for Arcane",
  "author": "getarcaneapp",
  "url": "https://github.com/getarcaneapp/templates",
  "version": "1.34.0",
  "templates": [
    {
      "id": "actual",
      "name": "Actual",
      "description": "Privacy-focused personal finance and budgeting server.",
      "version": "1.0.0",
      "author": "getarcaneapp",
      "compose_url": "https://registry.getarcane.app/templates/actual/compose.yaml",
      "env_url": "https://registry.getarcane.app/templates/actual/.env.example",
      "documentation_url": "https://github.com/getarcaneapp/templates/tree/main/templates/actual",
      "icon_url": "https://cdn.jsdelivr.net/gh/selfhst/icons@main/svg/actual-budget.svg",
      "content_hash": "6b76ab3ef557e33aa64c54f913c2a0a6582867b14e81525c7a341a2ff004b761",
      "tags": ["finance", "budgeting"]
    },
    {
      "id": "adguard-home",
      "name": "AdGuard Home",
      "description": "Network-wide DNS server for blocking ads, tracking, and malicious domains.",
      "version": "1.0.0",
      "author": "getarcaneapp",
      "compose_url": "https://registry.getarcane.app/templates/adguard-home/compose.yaml",
      "env_url": "https://registry.getarcane.app/templates/adguard-home/.env.example",
      "documentation_url": "https://github.com/getarcaneapp/templates/tree/main/templates/adguard-home",
      "icon_url": "https://cdn.jsdelivr.net/gh/selfhst/icons@main/svg/adguard-home.svg",
      "content_hash": "1c0d57d99039f8d9f917e4b4e7ae24f4b83f54770482e609a3d16404e45e4cc6",
      "tags": ["dns", "adblock", "privacy"]
    },
    {
      "id": "affine",
      "name": "AFFiNE",
      "description": "AFFiNE is a workspace with fully merged docs, whiteboards and databases.",
      "version": "1.0.0",
      "author": "lesi97",
      "compose_url": "https://registry.getarcane.app/templates/affine/compose.yml",
      "env_url": "https://registry.getarcane.app/templates/affine/.env.example",
      "documentation_url": "https://github.com/getarcaneapp/templates/tree/main/templates/affine",
      "icon_url": "https://cdn.jsdelivr.net/gh/selfhst/icons@main/svg/affine.svg",
      "content_hash": "41aa860f430cf6d9cc2f322719b3145c12a5d9ea82fefec9f6174c37560f4067",
      "tags": ["Productivity", "Notes"]
    },
    {
      "id": "appsmith",
      "name": "Appsmith",
      "description": "Open-source low-code platform for building internal tools and dashboards.",
      "version": "1.0.0",
      "author": "getarcaneapp",
      "compose_url": "https://registry.getarcane.app/templates/appsmith/compose.yaml",
      "env_url": "https://registry.getarcane.app/templates/appsmith/.env.example",
      "documentation_url": "https://github.com/getarcaneapp/templates/tree/main/templates/appsmith",
      "icon_url": "https://cdn.jsdelivr.net/gh/selfhst/icons@main/webp/appsmith.webp",
      "content_hash": "732c4002bcbe43b78e9361973c3368da58094b41c93e38715d0d6546b6d767bf",
      "tags": ["development", "low-code", "productivity"]
    },
    {
      "id": "archiveteam-warrior",
      "name": "Archiveteam Warrior",
      "description": "Let your machine contribute to archiving the web by running Archiveteam Warrior projects.",
      "version": "1.0.0",
      "author": "LeviSnoot",
      "compose_url": "https://registry.getarcane.app/templates/archiveteam-warrior/compose.yml",
      "env_url": "https://registry.getarcane.app/templates/archiveteam-warrior/.env.example",
      "documentation_url": "https://github.com/getarcaneapp/templates/tree/main/templates/archiveteam-warrior",
      "icon_url": "https://cdn.jsdelivr.net/gh/selfhst/icons@main/png/archiveteam-warrior.png",
      "content_hash": "c0eef9bcd03ec14554067f0e2fc27f0208ed43b1edff08b4d07b086c57f590a0",
      "tags": ["archive", "preservation", "web"]
    },
    {
      "id": "audiobookshelf",
      "name": "Audiobookshelf",
      "description": "Self-hosted audiobook and podcast server.",
      "version": "1.0.0",
      "author": "getarcaneapp",
      "compose_url": "https://registry.getarcane.app/templates/audiobookshelf/compose.yaml",
      "env_url": "https://registry.getarcane.app/templates/audiobookshelf/.env.example",
      "documentation_url": "https://github.com/getarcaneapp/templates/tree/main/templates/audiobookshelf",
      "icon_url": "https://cdn.jsdelivr.net/gh/selfhst/icons@main/svg/audiobookshelf.svg",
      "content_hash": "ea108b9d8112a4eb50f8ece5a1133e21784fe9ab059a28fd994929521e00d38b",
      "tags": ["media", "audiobooks", "podcasts"]
    },
    {
      "id": "authentik",
      "name": "Authentik",
      "description": "Identity provider for SSO, OAuth2/OIDC, SAML, LDAP, and application access.",
      "version": "1.0.0",
      "author": "getarcaneapp",
      "compose_url": "https://registry.getarcane.app/templates/authentik/compose.yaml",
      "env_url": "https://registry.getarcane.app/templates/authentik/.env.example",
      "documentation_url": "https://github.com/getarcaneapp/templates/tree/main/templates/authentik",
      "icon_url": "https://cdn.jsdelivr.net/gh/selfhst/icons@main/svg/authentik.svg",
      "content_hash": "283cef3f8fb09f4131dcf5e8b91c076e7b584840a491a8ed25eb948960d6603d",
      "tags": ["identity", "sso", "authentication"]
    },
    {
      "id": "autobrr",
      "name": "autobrr",
      "description": "IRC announce monitoring and filtered download automation.",
      "version": "1.0.0",
      "author": "getarcaneapp",
      "compose_url": "https://registry.getarcane.app/templates/autobrr/compose.yaml",
      "env_url": "https://registry.getarcane.app/templates/autobrr/.env.example",
      "documentation_url": "https://github.com/getarcaneapp/templates/tree/main/templates/autobrr",
      "icon_url": "https://cdn.jsdelivr.net/gh/selfhst/icons@main/svg/autobrr.svg",
      "content_hash": "b6aa1754b0d2b919757a16d669a6519dc7e159aae52f392fc7595af5216f3b82",
      "tags": ["media", "automation"]
    },
    {
      "id": "backrest",
      "name": "Backrest",
      "description": "Restic backup management with schedules, snapshots, and restore tools.",
      "version": "1.0.0",
      "author": "getarcaneapp",
      "compose_url": "https://registry.getarcane.app/templates/backrest/compose.yaml",
      "env_url": "https://registry.getarcane.app/templates/backrest/.env.example",
      "documentation_url": "https://github.com/getarcaneapp/templates/tree/main/templates/backrest",
      "icon_url": "https://cdn.jsdelivr.net/gh/selfhst/icons@main/svg/backrest.svg",
      "content_hash": "9517c292240a4fa242cce9fbee4a8f828a68c7dcec212f1177938d379f69031d",
      "tags": ["backup", "storage"]
    },
    {
      "id": "baikal",
      "name": "Baikal",
      "description": "A lightweight CalDAV and CardDAV server for managing calendars and contacts.",
      "version": "1.0.0",
      "author": "rjcndev",
      "compose_url": "https://registry.getarcane.app/templates/baikal/compose.yml",
      "env_url": "https://registry.getarcane.app/templates/baikal/.env.example",
      "documentation_url": "https://github.com/getarcaneapp/templates/tree/main/templates/baikal",
      "icon_url": "https://cdn.jsdelivr.net/gh/selfhst/icons@main/png/baikal.png",
      "content_hash": "2768cc0b250d06c6875088dde337831dfae03b69e2c053d6bc681ed4da3aead8",
      "tags": ["Calendar", "CalDAV", "CardDAV", "Contacts"]
    },
    {
      "id": "bazarr",
      "name": "Bazarr",
      "description": "Subtitle management for Sonarr and Radarr libraries.",
      "version": "1.0.0",
      "author": "getarcaneapp",
      "compose_url": "https://registry.getarcane.app/templates/bazarr/compose.yaml",
      "env_url": "https://registry.getarcane.app/templates/bazarr/.env.example",
      "documentation_url": "https://github.com/getarcaneapp/templates/tree/main/templates/bazarr",
      "icon_url": "https://cdn.jsdelivr.net/gh/selfhst/icons@main/svg/bazarr.svg",
      "content_hash": "4198e9f96764fb2f30c633b883784ad6254b577136f83a351afb85c14ef3d43e",
      "tags": ["media", "library"]
    },
    {
      "id": "bento-pdf",
      "name": "BentoPDF",
      "description": "Client-side PDF toolkit",
      "version": "1.0.0",
      "author": "xPand4B",
      "compose_url": "https://registry.getarcane.app/templates/bento-pdf/docker-compose.yaml",
      "env_url": "https://registry.getarcane.app/templates/bento-pdf/.env.example",
      "documentation_url": "https://github.com/getarcaneapp/templates/tree/main/templates/bento-pdf",
      "icon_url": "https://cdn.jsdelivr.net/gh/selfhst/icons@main/svg/bentopdf.svg",
      "content_hash": "afa043bd81c0e149217e4a45dff6439da9b90c31266ad609bc3b00f40d31a053",
      "tags": ["Productivity", "PDF"]
    },
    {
      "id": "beszel",
      "name": "Beszel",
      "description": "Lightweight server monitoring hub with Docker stats, historical data, and alerts.",
      "version": "1.0.0",
      "author": "getarcaneapp",
      "compose_url": "https://registry.getarcane.app/templates/beszel/compose.yaml",
      "env_url": "https://registry.getarcane.app/templates/beszel/.env.example",
      "documentation_url": "https://github.com/getarcaneapp/templates/tree/main/templates/beszel",
      "icon_url": "https://cdn.jsdelivr.net/gh/selfhst/icons@main/svg/beszel.svg",
      "content_hash": "bbb0685076397ac37b995faa51d93d73648275a60674e75ec0ccd2a072f2708d",
      "tags": ["monitoring", "metrics", "servers"]
    },
    {
      "id": "bookstack",
      "name": "BookStack",
      "description": "Simple self-hosted platform for organizing documentation and wiki content.",
      "version": "1.0.0",
      "author": "getarcaneapp",
      "compose_url": "https://registry.getarcane.app/templates/bookstack/compose.yaml",
      "env_url": "https://registry.getarcane.app/templates/bookstack/.env.example",
      "documentation_url": "https://github.com/getarcaneapp/templates/tree/main/templates/bookstack",